{
  "schema_version": 2,
  "backup_id": "22222222-2222-4222-8222-222222222222",
  "created_at": "2026-10-28T00:00:00Z",
  "scope": "instance_data_root",
  "world_id": null,
  "world_alias": null,
  "source_token": "11111111-1111-4111-8111-111111111111",
  "consistency": "best_effort",
  "game": null,
  "profile_id": null,
  "adapter_version": null,
  "tool_version": "0.1.0",
  "compression": "zstd",
  "archive_format": "tar",
  "characters": [],
  "entry_count": 0,
  "file_count": 0,
  "total_bytes": "0",
  "entries": [],
  "extensions": {
    "platform": "synthetic",
    "arch": "synthetic",
    "boundary_verified": false,
    "instance_source": {
      "instance_id": "11111111-1111-4111-8111-111111111111",
      "installation_id": "33333333-3333-4333-8333-333333333333",
      "installation_sha256": "aaaaaaaaaaaaaaaaaaaaaaaaaaaaaaaaaaaaaaaaaaaaaaaaaaaaaaaaaaaaaaaa",
      "binding_verified": false
    }
  },
  "compression_version": "synthetic",
  "world_contexts": []
}
